,title,comb
0,Pirates of the Caribbean: Dead Men Tell No Tales,Joachim Rønning Espen Sandberg Johnny Depp Javier Bardem Geoffrey Rush Adventure Action Fantasy Comedy
1,Justice League,Zack Snyder Ben Affleck Henry Cavill Gal Gadot Action Adventure Fantasy Sci-Fi
2,Thor: Ragnarok,Taika Waititi Chris Hemsworth Tom Hiddleston Cate Blanchett Action Adventure Fantasy Sci-Fi
3,Guardians of the Galaxy Vol. 2,James Gunn Chris Pratt Zoe Saldana Dave Bautista Action Adventure Comedy Sci-Fi
4,The King's Daughter,Sean McNamara Pierce Brosnan William Hurt Benjamin Walker Fantasy Action Adventure
5,Extinction Jurassic Predators 2017,Adam Spinks Ben Loyd-Holmes Sarah Mac Neil Newbon Thriller Adventure
6,For Here or to Go?,Rucha Humnabadkar Ali Fazal Melanie Chandra Omi Vaidya Drama Comedy
7,Защитники,Sarik Andreasyan Anton Pampushnyy Sanzhar Madiyev Sebastien Sisak Action Fantasy Sci-Fi
8,The Outcasts,Peter Hutchings Victoria Justice Eden Sher Ashley Rickards Comedy
9,Wonder Woman,Patty Jenkins Gal Gadot Chris Pine Robin Wright Action Adventure Fantasy
10,Sly Cooper,Kevin Munroe Chris Murphy Ian James Corlett Matt Olsen Animation Adventure Comedy Action Family
11,The Circle,James Ponsoldt Emma Watson Tom Hanks John Boyega Drama Thriller Sci-Fi
12,Pitch Perfect 3,Trish Sie Anna Kendrick Rebel Wilson Brittany Snow Comedy
13,The Master,
14,The Devil's Candy,Sean Byrne Ethan Embry Shiri Appleby Kiara Glasco Horror
15,Las Plantas,Roberto Doveris Violeta Castillo Ingrid Isensee Mauricio Vaca Drama
16,"Return to Return to Nuke 'Em High, aka Volume 2",Lloyd Kaufman Asta Paredes Catherine Corcoran Zac Amino Comedy Horror
17,The Cheerleader Murders,David Jackson Amanda Leighton Samantha Boscarino Hannah Kasulka TV Movie Thriller
18,Dean,Demetri Martin Demetri Martin Gillian Jacobs Christine Woods Comedy
19,Leatherface,Alexandre Bustillo Julien Maury Stephen Dorff Lili Taylor Sam Strike Horror
20,47 Meters Down,Johannes Roberts Claire Holt Mandy Moore Chris Johnson Drama Thriller Horror Adventure
21,Porto,Gabe Klinger Lucie Lucas Anton Yelchin Paulo Calatré Romance Drama
22,Mamaboy,Aaron Leong Sean O'Donnell Alexandria DeBerry Gary Busey Comedy Drama Family Fantasy Romance Sci-Fi
23,David Lynch: The Art Life,
24,The Promise,Terry George Oscar Isaac Charlotte Le Bon Christian Bale History Romance Drama
25,All Eyez on Me,Benny Boom Demetrius Shipp Jr. Danai Gurira Kat Graham Drama Music
26,Colossal,Nacho Vigalondo Anne Hathaway Jason Sudeikis Tim Blake Nelson Action Comedy Drama Fantasy Sci-Fi
27,Voyage of Time: Life's Journey,
28,London Town,Derrick Borte Jonathan Rhys Meyers Daniel Huttlestone Dougray Scott Drama Music
29,Brimstone,Martin Koolhoven Guy Pearce Dakota Fanning Carice van Houten Mystery Thriller Western
30,The White King,Alex Helfrecht Jörg Tittel Agyness Deyn Jonathan Pryce Fiona Shaw Drama Sci-Fi
31,Risk,Laura Poitras Julian Assange Sarah Harrison Jacob Appelbaum Documentary
32,Kiki,
33,Shangri-La Suite,Eddie O'Keefe Emily Browning Luke Grimes Ron Livingston Romance Drama Crime
34,Безбог,Ralitza Petrova Irena Ivanova Ivan Nalbantov Ventzislav Konstantinov Drama
35,The Space Between Us,Peter Chelsom Asa Butterfield Britt Robertson Carla Gugino Romance Adventure Sci-Fi Drama
36,National Bird,
37,I Am Not Your Negro,Raoul Peck Samuel L. Jackson James Baldwin Malcolm X Documentary
38,Kedi,
39,A Dog's Purpose,Lasse Hallström Dennis Quaid Britt Robertson Josh Gad Comedy Drama Family Fantasy
40,Manifesto,Julian Rosefeldt Cate Blanchett Erika Bauer Ruby Bustamante Drama
41,The Little Hours,Jeff Baena Alison Brie Dave Franco Aubrey Plaza Comedy
42,Fist Fight,Richie Keen Charlie Day Ice Cube Tracy Morgan Comedy
43,Sleepless,Baran bo Odar Jamie Foxx Michelle Monaghan Dermot Mulroney Action Crime Thriller
44,A Cure for Wellness,Gore Verbinski Dane DeHaan Jason Isaacs Mia Goth Mystery Thriller Horror Sci-Fi
45,Mesteren,Charlotte Sieling Jakob Oftebro Ane Dahl Torp Søren Malling Drama Comedy
46,xXx: Return of Xander Cage,D.J. Caruso Vin Diesel Ice Cube Samuel L. Jackson Action Adventure Crime
47,The Bye Bye Man,Stacy Title Douglas Smith Lucien Laviscount Cressida Bonas Horror Thriller
48,Prevenge,Alice Lowe Alice Lowe Jo Hartley Kate Dickie Horror Comedy Drama Thriller Fantasy
49,The Lego Batman Movie,Chris McKay Will Arnett Zach Galifianakis Michael Cera Action Animation Comedy Family Fantasy
50,Noces,Stephan Streker Lina El Arabi Sébastien Houbani Babak Karimi Drama
51,功夫瑜伽,Stanley Tong Jackie Chan Disha Patani Sonu Sood Mystery Action Adventure Comedy
52,रंगून,Vishal Bhardwaj Saif Ali Khan Shahid Kapoor Kangana Ranaut War History Drama Romance
53,Death Race 2050,G.J. Echternkamp Manu Bennett Malcolm McDowell Marci Miller Action Comedy Sci-Fi
54,Trespass Against Us,Adam Smith Michael Fassbender Brendan Gleeson Lyndsey Marshal Action Drama Crime Thriller
55,Claire in Motion,Lisa Robinson Annie J. Howell Betsy Brandt Chris Beetem Zev Haworth Drama
56,Coin Heist,Emily Hagins Alex Saxon Alexis G. Zall Sasha Pieterse Family Crime
57,Rings,F. Javier Gutiérrez Matilda Anna Ingrid Lutz Alex Roe Johnny Galecki Horror
58,Clinical,Alistair Legrand Vinessa Shaw Kevin Rahm Aaron Stanford Thriller
59,Jim Gaffigan: Cinco,
60,Eu Fico Loko,Bruno Garotti Michel Joelsas Alessandra Negrini Marcello Airoldi Comedy
61,The Crash,Aram Rappaport Frank Grillo Minnie Driver AnnaSophia Robb Crime Thriller
62,傷物語〈Ⅲ冷血篇〉,Tatsuya Oishi Akiyuki Shinbo Hiroshi Kamiya Yui Horie Maaya Sakamoto Animation Fantasy Mystery
63,John Wick: Chapter 2,Chad Stahelski Keanu Reeves Common Laurence Fishburne Thriller Action Crime
64,Get Out,Jordan Peele Daniel Kaluuya Allison Williams Bradley Whitford Mystery Thriller Horror
65,Logan,James Mangold Hugh Jackman Patrick Stewart Dafne Keen Action Drama Sci-Fi
66,Kong: Skull Island,Jordan Vogt-Roberts Tom Hiddleston Samuel L. Jackson Brie Larson Action Adventure Fantasy
67,City of Tiny Lights,Pete Travis Riz Ahmed Billie Piper James Floyd Crime Drama Thriller
68,T2 Trainspotting,Danny Boyle Ewan McGregor Jonny Lee Miller Ewen Bremner Crime Drama
69,Science Fiction Volume One: The Osiris Child,Shane Abbess Kellan Lutz Daniel MacPherson Isabel Lucas Sci-Fi
70,Before I Fall,Ry Russo-Young Zoey Deutch Halston Sage Logan Miller Mystery Drama Thriller
71,The Big Sick,Michael Showalter Kumail Nanjiani Zoe Kazan Holly Hunter Comedy Drama Romance
72,Ingrid Goes West,Matt Spicer Aubrey Plaza Elizabeth Olsen O'Shea Jackson Jr. Drama Comedy
73,I Don't Feel at Home in This World Anymore,Macon Blair Melanie Lynskey Elijah Wood David Yow Comedy Crime Drama Thriller
74,King Arthur: Legend of the Sword,Guy Ritchie Charlie Hunnam Astrid Bergès-Frisbey Jude Law Action Drama Fantasy
75,Beauty and the Beast,Bill Condon Emma Watson Dan Stevens Luke Evans Family Fantasy Romance
76,Take the 10,Chester Tam Stella Maeve Andy Samberg Josh Peck Comedy
77,The Boss Baby,Tom McGrath Alec Baldwin Miles Bakshi Jimmy Kimmel Animation Comedy Family
78,Justice League Dark,Jay Oliva Matt Ryan Jason O'Mara Camilla Luddington Action Animation Fantasy Sci-Fi Thriller
79,Έτερος Εγώ,Sotiris Tsafoulias Pigmalion Dadakaridis Dimitris Katalifos Manos Vakousis Thriller Mystery
80,Machines,
81,Call Me by Your Name,Luca Guadagnino Timothée Chalamet Armie Hammer Michael Stuhlbarg Romance Drama
82,iBoy,Adam Randall Bill Milner Maisie Williams Rory Kinnear Action Crime Sci-Fi Thriller
83,L'ora legale,Salvatore Ficarra Valentino Picone Salvatore Ficarra Valentino Picone Vincenzo Amato Comedy
84,Catfight,Onur Tukel Sandra Oh Anne Heche Alicia Silverstone Comedy Drama
85,A Ghost Story,David Lowery Casey Affleck Rooney Mara Will Oldham Drama Fantasy Romance
86,Ghost in the Shell,Rupert Sanders Scarlett Johansson Michael Pitt Pilou Asbæk Action Sci-Fi Thriller
87,Pork Pie,Matt Murphy Dean O'Gorman James Rolleston Ashleigh Cummings Action Comedy Crime
88,Bill Burr: Walk Your Way Out,
89,XX,Karyn Kusama Jovanka Vuckovic Roxanne Benjamin St. Vincent Natalie Brown Melanie Lynskey Breeda Wool Horror
90,Ok Jaanu,Shaad Ali Aditya Roy Kapoor Shraddha Kapoor Leela Samson Drama Romance
91,Fifty Shades Darker,James Foley Dakota Johnson Jamie Dornan Eric Johnson Drama Romance
92,Wilson,Craig Johnson Woody Harrelson Sandy Oian-Thomas Shaun Brown Drama Comedy
93,Притяжение,Fyodor Bondarchuk Rinal Mukhametov Sergey Garmash Oleg Menshikov Drama Romance Sci-Fi
94,Mes trésors,Pascal Bourdiaux Jean Reno Reem Kherici Camille Chamoux Comedy
95,Don't Knock Twice,Caradog W. James Katee Sackhoff Lucy Boynton Javier Botet Horror
96,The Ticket,Ido Fluk Dan Stevens Malin Åkerman Kerry Bishé Drama
97,Lavender,Ed Gass-Donnelly Abbie Cornish Dermot Mulroney Diego Klattenhoff Drama Thriller
98,Detour,Christopher Smith Tye Sheridan Bel Powley Emory Cohen Thriller
99,The Book of Love,Bill Purple Jason Sudeikis Maisie Williams Jessica Biel Drama
100,Toivon tuolla puolen,Aki Kaurismäki Sakari Kuosmanen Sherwan Haji Simon Al-Bazoon Comedy Drama
101,Trumped: Inside the Greatest Political Upset of All Time,
102,Hickey,Alex Grossman Troy Doherty Flavia Watson Raychel Diane Weiner Comedy
103,Слишком свободный человек,
104,Orpheline,Arnaud des Pallières Adèle Exarchopoulos Adèle Haenel Solène Rigot Drama
105,Nieve negra,Martín Hodara Ricardo Darín Leonardo Sbaraglia Laia Costa Mystery Drama Crime Thriller
106,Neal Brennan: 3 Mics,
107,"Michael Bolton's Big, Sexy Valentine's Day Special",Akiva Schaffer Scott Aukerman Michael Bolton Adam Scott Sarah Shahi Comedy Music
108,Lost in Florence,Evan Oppenheimer Brett Dalton Emily Atack Stana Katic Adventure Drama Romance
109,Bad Kids of Crestview Academy,Ben Browder Gina Gershon Sean Astin Sammi Hanratty Mystery Comedy Thriller Sci-Fi Fantasy
110,Smetto quando voglio: Masterclass,Sydney Sibilia Edoardo Leo Valerio Aprea Stefano Fresi Action Comedy Crime
111,Shepherds and Butchers,Oliver Schmitz Andrea Riseborough Steve Coogan Deon Lotz Drama
112,In Dubious Battle,James Franco James Franco Nat Wolff Selena Gomez Drama
113,Berlin Syndrome,Cate Shortland Teresa Palmer Max Riemelt Matthias Habich Mystery Thriller Drama Horror
114,Az állampolgár,
115,All This Panic,Jenny Gage Dusty Rose Ryan Lena M. Ginger Leigh Ryan Documentary
116,Youth in Oregon,Joel David Moore Frank Langella Billy Crudup Christina Applegate Comedy Drama
117,Song to Song,Terrence Malick Michael Fassbender Ryan Gosling Rooney Mara Drama Music Romance
118,To the Bone,Marti Noxon Lily Collins Carrie Preston Lili Taylor Drama
119,Girlfriend's Day,Michael Stephenson Bob Odenkirk Amber Tamblyn Natasha Lyonne Comedy Drama
120,好极了,Liu Jian Yang Siming Cao Kou Ma Xiaofeng Animation Crime
121,American Fable,Anne Hamilton Peyton Kennedy Richard Schiff Kip Pardue Drama Thriller
122,Katherine Ryan: In Trouble,
123,Mein Blind Date mit dem Leben,Marc Rothemund Kostja Ullmann Anna Maria Mühe Jacob Matschenz Comedy
124,Dobra žena,Mirjana Karanović Mirjana Karanović Boris Isaković Marko Nikolić Drama
125,Pokot,Agnieszka Holland Agnieszka Mandat-Grabka Wiktor Zborowski Jakub Gierszał Crime Drama Mystery Thriller
126,God's Own Country,Francis Lee Josh O'Connor Alec Secareanu Ian Hart Romance Drama
127,Una mujer fantástica,Sebastián Lelio Daniela Vega Francisco Reyes Luis Gnecco Drama
128,Colo,Teresa Villaverde João Pedro Vaz Alice Albergaria Borges Beatriz Batarda Drama
129,"Ana, mon amour",Călin Peter Netzer Mircea Postelnicu Diana Cavallioti Carmen Tănase Drama
130,Hostages,Rezo Gigineishvili Irakli Kvirikadze Tinatin Dalakishvili Merab Ninidze Drama
131,Lovesong,So Yong Kim Jena Malone Riley Keough Jessie Ok Gray Drama Romance
132,Jen Kirkman: Just Keep Livin',
133,Майор Гром,Vladimir Besedin Aleksandr Gorbatov Ivan Fominov Anton Kuznetsov Action Adventure Sci-Fi Drama
134,Becoming Warren Buffett,Peter W. Kunhardt Brian Oakes Warren Buffett Susan Buffett Bill Gates Documentary
135,Everybody Loves Somebody,Catalina Aguilar Mastretta Karla Souza José María Yazpik Ben O'Toole Romance Comedy
136,Raid dingue,Dany Boon Alice Pol Dany Boon Michel Blanc Action Comedy
137,Britney Ever After,Leslie Libman Natasha Bassett Jenna Berman Matthew Harrison Drama TV Movie
138,"Nick Cannon: Stand Up, Don't Shoot",
139,Fair Haven,Kerstin Karlhuber Tom Wopat Michael Grant Gregory Harrison Family Drama
140,Oklahoma City,
141,Asteria,
142,The Glass Castle,Destin Cretton Brie Larson Woody Harrelson Naomi Watts Drama
143,Fare,Thomas Torrey Thomas Torrey Katherine Drew J.R. Adduci Drama Thriller
144,Tom of Finland,Dome Karukoski Pekka Strang Lauri Tilkanen Jakob Oftebro Drama
145,Deconstructing Sgt. Pepper's Lonely Hearts Club Band,
146,Donald Cried,Kris Avedisian Louisa Krause Allie Marshall Ariana DeFusco Drama Comedy
147,Zombie Pizza,Mike Dudko Rachel Barrer Gleb Kaminer Shaun Rey Horror Comedy
148,Their Finest,Lone Scherfig Gemma Arterton Sam Claflin Bill Nighy Romance War Comedy Drama
149,The Ottoman Lieutenant,Joseph Ruben Michiel Huisman Hera Hilmar Josh Hartnett Romance Drama War
150,Lady Macbeth,William Oldroyd Florence Pugh Cosmo Jarvis Paul Hilton Drama
151,The Sense of an Ending,Ritesh Batra Jim Broadbent Charlotte Rampling Harriet Walter Mystery Drama
152,Carrie Pilby,Susan Johnson Bel Powley Nathan Lane Gabriel Byrne Drama Comedy
153,The Institute,James Franco Pamela Romanowsky James Franco Tim Blake Nelson Lori Singer Thriller
154,Internet - O Filme,Filippo Capuzzi Lapietra Felipe Castanhari Rafinha Bastos PC Siqueira Comedy
155,Patients,Mehdi Idir Grand Corps Malade Pablo Pauly Soufiane Guerrab Moussa Mansaly Drama Comedy
156,The Shack,Stuart Hazeldine Sam Worthington Octavia Spencer Tim McGraw Drama Fantasy
157,Невеста,Svyatoslav Podgayevskiy Victoria Agalakova Vyacheslav Chepurchenko Alexandra Rebenok Mystery Horror Thriller
158,Life,Daniel Espinosa Jake Gyllenhaal Rebecca Ferguson Ryan Reynolds Horror Sci-Fi Thriller
159,Kaabil,Sanjay Gupta Hrithik Roshan Yami Gautam Ronit Roy Action Crime Romance
160,The Raking,Bryan Brewer Cree Kelly Allie Rivera Thatcher Robinson Horror
161,Sleight,J.D. Dillard Jacob Latimore Seychelle Gabriel Sasheer Zamata Drama Thriller Action Sci-Fi
162,Kurt Braunohler: Trust Me,
163,Buster's Mal Heart,Sarah Adina Smith Rami Malek DJ Qualls Kate Lyn Sheil Mystery Drama
164,더 킹,Han Jae-rim Jo In-sung Jung Woo-sung Bae Seong-woo Drama Crime
165,Ghosts of Darkness,David Ryan Keith Michael Koltes Paul Flannery Lisa Livingstone Horror
166,Power Rangers,Dean Israelite Dacre Montgomery Naomi Scott RJ Cyler Action Adventure Sci-Fi
167,Alien: Covenant,Ridley Scott Michael Fassbender Katherine Waterston Billy Crudup Horror Sci-Fi Thriller
168,Beata ignoranza,Massimiliano Bruno Marco Giallini Alessandro Gassman Teresa Romagnoli Comedy
169,Free Fire,Ben Wheatley Sharlto Copley Armie Hammer Brie Larson Action Comedy Crime Thriller
170,Casting JonBenet,Kitty Green Hannah Cagwin Aeona Cruz Liv Bagley Documentary
171,Django,Etienne Comar Reda Kateb Cécile de France Àlex Brendemühl Drama
172,Amy Schumer: The Leather Special,
173,Saattokeikka,Samuli Valkama Noah Kin Heikki Nousiainen Mikko Nousiainen Comedy Drama
174,The Dinner,Oren Moverman Richard Gere Laura Linney Steve Coogan Drama Thriller
175,Wilde Maus,Josef Hader Josef Hader Georg Friedrich Crina Semciuc Comedy Crime Drama
176,The Avenue,Brian Vernick Cheryl M. Bailey Louis Ballezzi Shawn Bittenbender Crime Drama
177,Arsenal,Steven C. Miller Nicolas Cage Christopher Rob Bowen Adrian Grenier Action Crime Thriller
178,Zona hostil,Adolfo Martínez Pérez Ariadna Gil Roberto Álamo Antonio Garrido War
179,Jim Norton: Mouthful of Shame,
180,From Straight A's to XXX,Vanessa Parise Haley Pullos Judd Nelson Sasha Clements Drama
181,The Invisible Guardian,Fernando González Molina Marta Etura  Elvira Mínguez Francesc Orella Thriller
182,Born in China,
183,Gemini,Aaron Katz Lola Kirke Zoë Kravitz John Cho Thriller
184,Trevor Noah: Afraid of the Dark,
185,Paris pieds nus,Fiona Gordon Dominique Abel Fiona Gordon Dominique Abel Emmanuelle Riva Comedy
186,Dave Chappelle: The Age of Spin,
187,David Bowie: The Last Five Years,Francis Whately Tony Visconti Gail Ann Dorsey Tony Basil Music Documentary
188,Sameblod,Amanda Kernell Lene Cecilia Sparrok Mia Sparrok Maj-Doris Rimpi Drama
189,The Evil Within,Andrew Getty Fred Koehler Sean Patrick Flanery Brianna Brown Horror
190,The Last Word,Mark Pellington Shirley MacLaine Amanda Seyfried Anne Heche Comedy Drama
191,CHiPS,Dax Shepard Michael Peña Dax Shepard Jessica McNamee Action Comedy Crime
192,Table 19,Jeffrey Blitz Anna Kendrick Craig Robinson June Squibb Comedy Drama
193,Going in Style,Zach Braff Morgan Freeman Michael Caine Alan Arkin Crime Comedy Drama
194,Bokeh,Geoffrey Orthwein Andrew Sullivan Maika Monroe Matt O'Leary Arnar Jónsson Drama Sci-Fi Thriller
195,Alibi.com,Philippe Lacheau Philippe Lacheau Élodie Fontan Julien Arruti Comedy
196,Dave Chappelle: Deep in the Heart of Texas,
197,All Nighter,Gavin Wiesen J.K. Simmons Analeigh Tipton Emile Hirsch Comedy
198,Monsieur & Madame Adelman,Nicolas Bedos Nicolas Bedos Doria Tillier Denis Podalydès Romance Drama Comedy
199,Deidra & Laney Rob a Train,Sydney Freeland Ashleigh Murray Rachel Crow Tim Blake Nelson Drama Comedy Crime
200,Carnage: Swallowing the Past,Simon Amstell Simon Amstell Linda Bassett Martin Freeman Sci-Fi Comedy Documentary
201,The Most Hated Woman in America,Tommy O'Haver Melissa Leo Josh Lucas Michael Chernus Crime Drama
202,Bitter Harvest,George Mendeluk Max Irons Samantha Barks Terence Stamp War Drama History Romance
203,Vengeance: A Love Story,Johnny Martin Nicolas Cage Deborah Kara Unger Anna Hutchison Action Thriller
204,El bar,Álex de la Iglesia Mario Casas Blanca Suárez Carmen Machi Horror Thriller Comedy
205,Middle Man,Ned Crowley Jim O'Heir Andrew J. West Josh McDermitt Drama Comedy Crime Thriller
206,Miles,Nathan Adloff Tim Boardman Missi Pyle Stephen Root Drama
207,Smurfs: The Lost Village,Kelly Asbury Julia Roberts Ariel Winter Ellie Kemper Adventure Animation Comedy Family
208,The Discovery,Charlie McDowell Jason Segel Rooney Mara Robert Redford Drama Romance Sci-Fi Thriller
209,Viceroy's House,Gurinder Chadha Hugh Bonneville Gillian Anderson Michael Gambon Drama History
210,嫌疑人X的献身,Alec Su Nick Wang Zhang Lu-Yi Ruby Lin Mystery Thriller
211,The Zookeeper's Wife,Niki Caro Jessica Chastain Johan Heldenbergh Daniel Brühl Drama History
212,Female Fight Club,Miguel A. Ferrer Amy Johnston Cortney Palm Rey Goyos Drama Action
213,Eloise,Robert Legato Eliza Dushku Robert Patrick Chace Crawford Horror Mystery Thriller
214,Gifted,Marc Webb Chris Evans Mckenna Grace Lindsay Duncan Drama
215,Teen Titans: The Judas Contract,Sam Liu Stuart Allan Jake T. Austin Taissa Farmiga Sci-Fi Animation Action
216,Louis C.K. 2017,
217,Cantábrico: Los dominios del oso pardo,
218,Aftermath,Elliott Lester Arnold Schwarzenegger Scoot McNairy Maggie Grace Drama Thriller
219,Dræberne fra Nibe,Ole Bornedal Nicolas Bro Ulrich Thomsen Mia Lyhne Comedy Crime Drama
220,The Bigfoot Project,Ricardo Herrera Andy Goldenberg Emily Roya O'Brien Nick Armstrong Comedy
221,The Case for Christ,Jon Gunn Mike Vogel Erika Christensen Faye Dunaway Drama
222,1 Mile to You,Leif Tilden Graham Rogers Billy Crudup Liana Liberato Drama Romance
223,Spark: A Space Tail,Aaron Woodley Jessica Biel Hilary Swank Susan Sarandon Adventure Animation Comedy Family Sci-Fi
224,"Everything, Everything",Stella Meghie Amandla Stenberg Nick Robinson Anika Noni Rose Drama Romance
225,Diary of a Wimpy Kid: The Long Haul,David Bowers Jason Ian Drucker Owen Asztalos Charlie Wright Comedy Family
226,Félicité,Alain Gomis Véro Tshanda Beya Mputu Gaetan Claudia Papi Mpaka Drama
227,Танцы насмерть,Andrey Volgin Agniya Ditkovskite Denis Shvedov Anvar Khalilulaev Action Fantasy
228,Время первых,Dmitriy Kiselev Evgeny Mironov Konstantin Khabenskiy Vladimir Ilin Adventure Drama History
229,Baywatch,Seth Gordon Dwayne Johnson Zac Efron Alexandra Daddario Action Comedy
230,Unforgettable,Denise Di Novi Rosario Dawson Katherine Heigl Geoff Stults Drama Thriller
231,Snatched,Jonathan Levine Amy Schumer Goldie Hawn Tom Bateman Action Comedy
232,The Mummy,Alex Kurtzman Tom Cruise Russell Crowe Annabelle Wallis Thriller Action Adventure
233,From a House on Willow Street,Alastair Orr Sharni Vinson Carlyn Burchell Steve John Ward Action Horror
234,The Fate of the Furious,F. Gary Gray Vin Diesel Jason Statham Dwayne Johnson Action Crime Thriller
235,After Porn Ends 2,Bryce Wagoner Ginger Lynn Allen Lisa Ann Janine Lindemulder Documentary
236,Burning Sands,Gerard McMurray Trevor Jackson Alfre Woodard Steve Harris Drama
237,Teleios,Ian Truitner Sunny Mabrey Lance Broadway T.J. Hoban Sci-Fi
238,Sandy Wexler,Steven Brill Adam Sandler Kevin James Terry Crews Comedy
239,Extortion,Phil Volken Bethany Joy Lenz Danny Glover Tim Griffin Action Adventure Crime Drama Thriller
240,Betting on Zero,
241,The Transfiguration,Michael O'Shea Eric Ruffin Chloe Levine Aaron Moten Horror Drama
242,Another Evil,Carson D. Mell Steve Zissis Mark Proksch Jennifer Irwin Comedy Horror
243,Win It All,Joe Swanberg Jake Johnson Aislinn Derbez Joe Lo Truglio Comedy
244,Captain Underpants: The First Epic Movie,David Soren Kevin Hart Ed Helms Thomas Middleditch Action Animation Comedy Family
245,3 Idiotas,Carlos Bolado Martha Higareda Alfonso Dosal Christian Vazquez Family Comedy
246,Band Aid,Zoe Lister-Jones Zoe Lister-Jones Adam Pally Fred Armisen Comedy
247,It Comes at Night,Trey Edward Shults Joel Edgerton Christopher Abbott Carmen Ejogo Horror Mystery Thriller
248,Megan Leavey,Gabriela Cowperthwaite Kate Mara Ramón Rodríguez Tom Felton Drama War
249,My Cousin Rachel,Roger Michell Rachel Weisz Sam Claflin Holliday Grainger Drama Romance
250,I Love You Both,Doug Archibald Artemis Pebdani Sasha Mitchell Angela Trimbur Comedy
251,11:55,Ari Issler Ben Snyder Victor Almanzar Shirley Rumierk Elizabeth Rodriguez Drama Crime
252,Cars 3,Brian Fee Owen Wilson Cristela Alonzo Chris Cooper Family Comedy Animation Adventure
253,Maudie,Aisling Walsh Sally Hawkins Ethan Hawke Gabrielle Rose Drama History Romance
254,バイオハザード ヴェンデッタ,Takanori Tsujimoto Kevin Dorman Matthew Mercer Erin Cahill Action Adventure Animation Horror Mystery Sci-Fi
255,Mad Families,Fred Wolf Leah Remini Charlotte McKinney Charlie Sheen Comedy
256,Les Fausses confidences,Luc Bondy Isabelle Huppert Louis Garrel Bulle Ogier Drama Comedy
257,The Marine 5: Battleground,James Nunn Mike Mizanin Anna Van Hooft Maryse Ouellet Mizanin Action
258,The Covenant,Robert Conway Monica Engesser Clint James Maria Olsen Horror
259,Rufus 2,Savage Steve Holland Jace Norman Davis Cleveland Haley Tju Family Fantasy Comedy
260,The Book of Henry,Colin Trevorrow Naomi Watts Jaeden Lieberher Jacob Tremblay Thriller Drama Crime
261,The Hero,Brett Haley Sam Elliott Laura Prepon Nick Offerman Drama
262,Citizen Jane: Battle for the City,Matt Tyrnauer Thomas Campanella Mindy Fullilove Alexander Garvin Documentary
263,The Wall,Doug Liman Aaron Taylor-Johnson John Cena Laith Nakli Drama Thriller War
264,Diamond Cartel,Salamat Mukhammed-Ali Armand Assante Karlygash Mukhamedzhanova Alexey Frandetti Action
265,Άφτερλωβ,
266,Phoenix Forgotten,Justin Barber Florence Hartigan Jeanine Jackson Chelsea Lopez Horror Mystery Sci-Fi
267,Pieles,Eduardo Casanova Jon Kortajarena Candela Peña Ana Polvorosa Drama Comedy
268,The Immortal Life of Henrietta Lacks,George C. Wolfe Rose Byrne Renée Elise Goldsberry Oprah Winfrey Drama
269,Kiehumispiste,
270,Tommy's Honour,Jason Connery Peter Mullan Jack Lowden Ophelia Lovibond Drama Romance
271,Handsome Devil,John Butler Nicholas Galitzine Fionn O'Shea Moe Dunford Drama
272,Lowriders,Ricardo de Montreuil Demián Bichir Gabriel Chavarria Theo Rossi Drama
273,Die Hölle – Inferno,Stefan Ruzowitzky Violetta Schurawlow Tobias Moretti Robert Palfrader Thriller
274,The Dark Tapes,Vincent J. Guastini Michael McQuown Cortney Palm David Hull Emilia Zoryan Horror Sci-Fi Thriller
275,Beyond Skyline,Liam O'Donnell Frank Grillo Bojana Novaković Iko Uwais Action Sci-Fi
276,Punching Henry,Gregori Viens Henry Phillips J.K. Simmons Sarah Silverman Comedy
277,How to Be a Latin Lover,Ken Marino Eugenio Derbez Salma Hayek Rob Lowe Comedy
278,The Trip to Spain,Michael Winterbottom Steve Coogan Rob Brydon Claire Keelan Drama Comedy
279,Nobody Speak: Trials of the Free Press,
280,Brigsby Bear,Dave McCary Kyle Mooney Claire Danes Mark Hamill Comedy Drama
281,Lucas Brothers: On Drugs,
282,I Am Heath Ledger,Derik Murray Adrian Buitenhuis Heath Ledger Kate Ledger Kim Ledger Documentary
283,Sand Castle,Fernando Coimbra Nicholas Hoult Logan Marshall-Green Henry Cavill Drama War
284,Moontrap: Target Earth,Robert Dyke Sarah Butler Damon Dayoub Charles Shaughnessy Action Sci-Fi Adventure
285,Uncertain,
286,"Гуляй, Вася!",Roman Karimov Efim Petrunin Lyubov Aksyonova Sofya Rayzman Comedy
287,조작된 도시,Park Kwang-hyun Ji Chang-wook Shim Eun-kyung Ahn Jae-hong Action
288,Unlocked,Michael Apted Noomi Rapace Orlando Bloom Michael Douglas Action Thriller
289,Voice from the Stone,Eric D. Howell Emilia Clarke Marton Csokas Caterina Murino Drama Mystery Romance Thriller
290,Small Crimes,E.L. Katz Nikolaj Coster-Waldau Jacki Weaver Robert Forster Drama Comedy Thriller Crime
291,Kolonya Cumhuriyeti,Murat Kepez Çaglar Çorumlu Büşra Pekin Mahir Ipek Comedy
292,A Few Less Men,Mark Lamprell Dacre Montgomery Xavier Samuel Kris Marshall Comedy
293,Bottom of the World,Richard Sears Jena Malone Douglas Smith Ted Levine Drama Mystery Thriller
