,title,comb
294,Stratton,Simon West Dominic Cooper Gemma Chan Connie Nielsen Action Thriller
295,The Lovers,Azazel Jacobs Debra Winger Tracy Letts Aidan Gillen Comedy
296,Baahubali 2: The Conclusion,S.S. Rajamouli Prabhas Rana Daggubati Sathyaraj Action Adventure History War
297,Tomato Red,Juanita Wilson Julia Garner Jake Weary Anna Friel Drama Thriller
298,Taking Earth,Grant Humphreys Ronan Quarmby Brad Richards Barbara Harrison Sci-Fi
299,Maria Bamford: Old Baby,
300,Omicidio all'italiana,Maccio Capatonda Maccio Capatonda Maccio Capatonda Maccio Capatonda Comedy
301,Norman: The Moderate Rise and Tragic Fall of a New York Fixer,Joseph Cedar Richard Gere Lior Ashkenazi Michael Sheen Comedy Thriller Drama
302,Seizure,Jamie Cymbal Ryan Simons Jimmy Allen Lindsay Bennett Chris Blackwood Horror
303,Amityville: The Awakening,Franck Khalfoun Bella Thorne Cameron Monaghan Jennifer Morrison Thriller Horror
304,The Beguiled,Sofia Coppola Colin Farrell Nicole Kidman Kirsten Dunst Drama Western
305,The Reagan Show,Sierra Pettengill Pacho Velez Ronald Reagan Nancy Reagan Barbara Walters Documentary
306,Baby Driver,Edgar Wright Ansel Elgort Lily James Kevin Spacey Action Crime
307,Okja,Bong Joon-ho Tilda Swinton Paul Dano Ahn Seo-hyun  Adventure Drama Fantasy Sci-Fi
308,Asylum of Darkness,Jay Woelfel Tim Thomerson Richard Hatch Tiffany Shepis Horror
309,Rough Night,Lucia Aniello Scarlett Johansson Jillian Bell Kate McKinnon Drama Comedy
310,Mindhorn,Sean Foley Julian Barratt Simon Farnaby Essie Davis Comedy
311,Oasis,Kevin Macdonald Richard Madden Flora Spencer-Longhurst Moshidi Motshegwa TV Movie Drama Sci-Fi
312,Generation Iron 2,Vlad Yudin Calum Von Moger Kai Greene Rich Piana Documentary
313,The Shadow Effect,Amariah Olson Obin Olson Jonathan Rhys Meyers Cam Gigandet Michael Biehn Sci-Fi Action Thriller
314,Commando 2: The Black Money Trail,Deven Bhojani Vidyut Jamwal Adah Sharma Freddy Daruwala Action
315,Monster High: Electrified,Avgousta Zourelidi Katy Townsend Debi Derryberry Cassandra Morris Family Animation
316,Patti Cake$,Geremy Jasper Danielle Macdonald Bridget Everett Siddharth Dhananjay Drama
317,Нелюбовь,Andrey Zvyagintsev Maryana Spivak Aleksey Rozin Matvey Novikov Drama
318,Moonlight in Vermont,Mel Damski Lacey Chabert Carlo Marks Jesse Moss Romance TV Movie
319,Handsome: A Netflix Mystery Movie,Jeff Garlin Jeff Garlin Natasha Lyonne Chris Redd Comedy
320,Batman & Bill,Don Argott Sheena M. Joyce Michael Uslan Roy Thomas Marc Tyler Nobleman Documentary
321,Monolith,Ivan Silvestrini Katrina Bowden Jay Hayden Damon Dayoub Drama Thriller
322,The Axe Murders of Villisca,Tony E. Valenzuela Robert Adamson Alex Frnka Conchata Ferrell Horror
323,Permission,Brian Crano Rebecca Hall Jason Sudeikis Dan Stevens Comedy Romance
324,Les fantômes d'Ismaël,Arnaud Desplechin Mathieu Amalric Marion Cotillard Charlotte Gainsbourg Drama Romance Thriller
325,The Hunter's Prayer,Jonathan Mostow Sam Worthington Odeya Rush Amy Landecker Action Thriller
326,Il a déjà tes yeux,Lucien Jean-Baptiste Lucien Jean-Baptiste Aïssa Maïga Vincent Elbaz Comedy
327,Beatriz at Dinner,Miguel Arteta Salma Hayek John Lithgow Connie Britton Comedy Drama
328,Get Me Roger Stone,Dylan Bank Morgan Pehme Daniel DiMauro Roger Stone Donald Trump Paul Manafort Documentary
329,Большой,Valery Todorovsky Alisa Freyndlikh Aleksandr Domogarov Nicolas Le Riche 
330,Boone: The Bounty Hunter,Robert Kirbyson John Hennigan Spencer Grammer Lorenzo Lamas Action
331,Despicable Me 3,Kyle Balda Pierre Coffin Steve Carell Kristen Wiig Trey Parker Action Animation Adventure Family Comedy
332,The Levelling,Hope Dickson Leach Ellie Kendrick David Troughton Jack Holden Drama
333,Tracktown,Alexi Pappas Jeremy Teicher Alexi Pappas Chase Offerle Rebecca Friday Drama
334,King Charles III,Rupert Goold Tim Pigott-Smith Charlotte Riley Oliver Chris Drama
335,Mommy Dead and Dearest,
336,Alcoholist,Lucas Pavetto Bill Moseley Gabriella Wright John Robinson Drama Thriller
337,Tickling Giants,
338,Dead Awake,Phillip Guzman Lori Petty Jesse Bradford Brea Grant Horror Thriller
339,Sage femme,Martin Provost Catherine Frot Catherine Deneuve Olivier Gourmet Comedy Drama
340,A Family Man,Mark Williams Gerard Butler Gretchen Mol Willem Dafoe Drama
341,The Wizard of Lies,Barry Levinson Robert De Niro Michelle Pfeiffer Hank Azaria Crime Drama History TV Movie
342,Revengeance,
343,ブラム,Hiroyuki Seshita Takahiro Sakurai Kana Hanazawa Sora Amamiya Action Animation Drama Horror Sci-Fi
344,Kill 'em All,Peter Malota Jean-Claude Van Damme Peter Stormare María Conchita Alonso Action
345,Kill Switch,Tim Smit Dan Stevens Bérénice Marlohe Charity Wakefield Sci-Fi
346,The Bad Batch,Ana Lily Amirpour Suki Waterhouse Jason Momoa Jayda Fink Thriller Romance Sci-Fi
347,Maigrets Night at the Crossroads,Sarah Harding Rowan Atkinson Lucy Cohu Shaun Dingwall TV Movie Crime Mystery Thriller
348,War for the Planet of the Apes,Matt Reeves Andy Serkis Woody Harrelson Steve Zahn Drama Sci-Fi War
349,Chronically Metropolitan,Xavier Manrique Shiloh Fernandez Ashley Benson Addison Timlin Drama Comedy
350,Kidnap,Luis Prieto Halle Berry Sage Correa Chris McGinn Drama Thriller
351,喜欢你,Derek Hui Takeshi Kaneshiro Zhou Dongyu Ming Xi Comedy Romance
352,How to Talk to Girls at Parties,John Cameron Mitchell Elle Fanning Nicole Kidman Ruth Wilson Comedy Music Romance Sci-Fi
353,The Meyerowitz Stories,Noah Baumbach Adam Sandler Ben Stiller Dustin Hoffman Comedy
354,War Machine,David Michôd Brad Pitt Anthony Hayes John Magaro Comedy Drama War
355,Becoming Bond,Josh Greenbaum George Lazenby Josh Lawson Kassandra Clementi Documentary Comedy
356,Vir Das: Abroad Understanding,
357,"Norm Macdonald: Hitler's Dog, Gossip & Trickery",
358,Laavor et hakir,Rama Burshtein Noa Kooler Amos Tamam Oz Zehavi Comedy Romance
359,Red Nose Day Actually,Richard Curtis Mat Whitecross Hugh Grant Colin Firth Liam Neeson TV Movie Comedy Romance
360,Whitney: Can I Be Me,Nick Broomfield Rudi Dolezal Whitney Houston Bobbi Kristina Brown Bobby Brown Music Documentary
361,Valerian and the City of a Thousand Planets,Luc Besson Dane DeHaan Cara Delevingne Clive Owen Adventure Sci-Fi Action
362,The Gracefield Incident,Mathieu Ratthe Alex C. Nachi Mathieu Ratthe Victor Andres Turgeon-Trelles Horror Sci-Fi Action
363,Long Strange Trip,Amir Bar-Lev Jerry Garcia Bob Weir Mickey Hart Music Documentary
364,Warning: This Drug May Kill You,
365,The Mars Generation,Michael Barnett Bill Nye Jeffrey Kluger Neil deGrasse Tyson Documentary
366,Kincsem,Gábor Herendi Buda Gulyás Ervin Nagy Petrik Andrea Tibor Gáspár Romance Adventure Drama History
367,Hasan Minhaj: Homecoming King,
368,Happy Burnout,André Erkau Kostja Ullmann Marleen Lohse Wotan Wilke Möhring Comedy
369,Sarah Silverman: A Speck of Dust,
370,Tri bogatyrya i Morskoy tsar,
371,Вурдалаки,Sergey Ginzburg Konstantin Kryukov Михаил Пореченков Aglaya Shilovskaya Horror Action Fantasy Thriller
372,Breakdown Lane,Bob Schultz Robert Conway Whitney Moore William 'Bill' Connor Owen Conway Drama Horror Thriller
373,Rock'n Roll,Guillaume Canet Guillaume Canet Marion Cotillard Gilles Lellouche Comedy Music
374,Black Butterfly,Brian Goodman Jonathan Rhys Meyers Antonio Banderas Piper Perabo Thriller
375,I Am Jane Doe,
376,Dumb: The Story of Big Brother Magazine,Patrick O'Dell Steve Rocco Jeff Tremaine Johnny Knoxville Documentary
377,Sweet Virginia,Jamie M. Dagg Jon Bernthal Christopher Abbott Rosemarie DeWitt 
378,The Farthest,Emer Reynolds Frank Drake John Casani Lawrence Krauss Documentary
379,A Stork's Journey,Toby Genkel Reza Memari Tilman Döbler Cooper Kelly Kramer Shannon Conley Adventure Animation
380,The Journey,Nick Hamm Timothy Spall Colm Meaney Freddie Highmore Drama
381,McLaren,Roger Donaldson Dwayne Cameron Mario Andretti Alastair Caldwell Documentary
382,All About the Money,Blake Freeman Danny Trejo Casper Van Dien Mindy Robinson Comedy Action Adventure
383,Он вам не Димон,
384,Brain on Fire,Gerard Barrett Chloë Grace Moretz Thomas Mann Richard Armitage Drama
385,루시드 드림,Kim Joon-Sung Go Soo Sol Kyung-gu Park Yoo-chun Sci-Fi Thriller
386,Drone,Jason Bourque Sean Bean Mary McCormack Joel David Moore Thriller
387,Dragonheart: Battle for the Heartfire,Patrik Syversen Marte Germaine Christensen Patrick Stewart Tom Rhys Harries Adventure
388,Stasis,Nicole Jones-Dion Anna Harr Mark Grossman Phyllis Spielman Adventure Sci-Fi
389,Amor.com,Anita Barbosa Isis Valverde Gil Coelho Joaquim Lopes Romance
390,Growing Up Smith,Frank Lotito Roni Akurati Brighton Sharbino Jason Lee Comedy Family Drama
391,AWOL,Deb Shoval Lola Kirke Breeda Wool Dale Soules Drama
392,Shimmer Lake,Oren Uziel Rainn Wilson Benjamin Walker John Michael Higgins Thriller Crime Drama Mystery
393,非凡任务,Alan Mak Anthony Pun Huang Xuan Duan Yihong Lang Yueting Action Crime Thriller
394,What Happened to Monday,Tommy Wirkola Noomi Rapace Marwan Kenzari Christian Rubeck Sci-Fi Thriller
395,The Son of Bigfoot,Ben Stassen Jérémie Degruson Tom Beck Cinda Adams Bob Barlen Animation Comedy
396,東京喰種 トーキョーグール,Kentaro Hagiwara Masataka Kubota Yu Aoi Fumika Shimizu Action Drama Horror Thriller
397,Testről és lélekről,Ildikó Enyedi Alexandra Borbély Morcsányi Géza Zoltán Schneider Drama Romance
398,Atomic Blonde,David Leitch Charlize Theron James McAvoy Sofia Boutella Action Thriller
399,God Of War,Gordon Chan Vincent Zhao Sammo Hung Regina Wan Action History
400,Aaron's Blood,Tommy Stovall James Martinez Trevor Sterling Stovall Michael Chieffo Drama Horror Mystery Thriller
401,재심,Kim Tae-yoon Jung Woo Kang Ha-Neul Kim Hae-sook Drama
402,Saving Banksy,
403,The Exception,David Leveaux Lily James Jai Courtney Eddie Marsan Drama
404,Goon: Last of the Enforcers,Jay Baruchel Seann William Scott Alison Pill Marc-André Grondin Comedy
405,Dunkirk,Christopher Nolan Fionn Whitehead Tom Glynn-Carney Jack Lowden Action Drama History Thriller War
406,பைரவா,Bharathan Vijay Keerthi Suresh Jagapati Babu Action
407,The Keepers,
408,The Summoning,Alberto G. Rodriguez Eric Roberts Leila Almas Jaime Zevallos Thriller Drama Mystery
409,Once Upon a Time in Venice,Mark Cullen Bruce Willis Jason Momoa John Goodman Action Comedy Thriller
410,Resurrecting Hassan,Carlo Guillermo Proto Denis Harting Peggy Roux Lauviah Harting Documentary
411,The Putin Interviews,
412,An Inconvenient Sequel: Truth to Power,Bonni Cohen Jon Shenk Al Gore Barack Obama Donald Trump Documentary
413,Rakka,Neill Blomkamp Sigourney Weaver Eugene Khumbanyiwa Robert Hobbs Action Sci-Fi
414,Jawbone,Thomas Q. Napper Johnny Harris Ian McShane Ray Winstone Action Drama
415,A Gray State,
416,공조,Sung-hoon Kim Hyun Bin Yoo Hae-jin Kim Joo-hyuk Action Drama Comedy
417,Altitude,Alex Merkin Dolph Lundgren Denise Richards Greer Grammer Action Thriller
418,Strong Island,
419,Cream,David Firth David Firth Carla Simpson Christian Webb Animation Comedy Sci-Fi
420,Órbita 9,Hatem Khraiche Clara Lago Belén Rueda Álex González Drama Sci-Fi Romance
421,Chasing Trane,John Scheinfeld Denzel Washington Common Bill Clinton Documentary
422,Mutafukaz,
423,Abacus: Small Enough to Jail,Steve James Neil Barofsky Ti-Hua Chang Jiayang Fan Documentary
424,Transformers: The Last Knight,Michael Bay Mark Wahlberg Josh Duhamel Laura Haddock Action Sci-Fi Thriller Adventure
425,Churchill,Jonathan Teplitzky Brian Cox Miranda Richardson John Slattery Drama Thriller War
426,Dina,
427,Tubelight,Kabir Khan Salman Khan Zhu Zhu Sohail Khan Drama History War
428,The Hatton Garden Job,Ronnie Thompson Matthew Goode Joely Richardson Larry Lamb Crime
429,Hampstead,Joel Hopkins Diane Keaton Brendan Gleeson James Norton Romance Comedy
430,1 Night,Minhal Baig Kyle Allen Isabelle Fuhrman Justin Chatwin Drama Romance
431,"Oh, Hello: On Broadway",Michael John Warren Alex Timbers Nick Kroll John Mulaney Steve Martin Comedy
432,Site Unseen: An Emma Fielding Mystery,Douglas Barr Courtney Thorne-Smith James Tupper Adam DiMarco Mystery
433,Savageland,Phil Guidry Simon Herbert David Whelan Monica Davis Edward L. Green Patrick Pedraza Horror Mystery
434,Ava,Léa Mysius Noée Abita Laure Calamy Juan Cano Drama
435,You Get Me,Brent Bonacorso Bella Thorne Halston Sage Taylor John Smith Thriller Romance Drama
436,Grey Lady,John Shea Eric Dane Natalie Zea Amy Madigan Thriller
437,Good Time,Joshua Safdie Ben Safdie Robert Pattinson Jennifer Jason Leigh Ben Safdie Drama Thriller Crime
438,Eat Local,Jason Flemyng Charlie Cox Tony Curran Mackenzie Crook Action Comedy Horror
439,Tuintje in mijn hart,Marc Waltman Sanne Langelaar Fockeline Ouwerkerk Imanuelle Grives Romance Drama
440,Selfie,Víctor García León Santiago Alverú Pepe Ocio Alicia Rubio Comedy
441,乘风破浪,Han Han Eddie Peng Deng Chao Zhao Liying Comedy Drama
442,கவண்,K. V. Anand Vijay Sethupathi Madonna Sebastian T. Rajendar Thriller Drama
443,Hell on Earth: The Fall of Syria and the Rise of ISIS,
444,The House,Andrew J. Cohen Amy Poehler Will Ferrell Allison Tolman Comedy
445,Five Came Back,Laurent Bouzereau Guillermo del Toro Steven Spielberg Paul Greengrass War Documentary
446,The Babymoon,Bailey Kobe Julie McNiven Shaun Sipos Jessica Camacho Romance Action Adventure Comedy Drama
447,Legion of Brothers,Greg Barker Jason Amerine George W. Bush Mark Nutsch Documentary
448,Estiu 1993,Carla Simón Laia Artigas Bruna Cusí David Verdaguer Drama Family
449,Rückkehr nach Montauk,Volker Schlöndorff Stellan Skarsgård Nina Hoss Bronagh Gallagher Drama
450,Chuck,Philippe Falardeau Liev Schreiber Naomi Watts Elisabeth Moss Drama
451,2:22,Paul Currie Michiel Huisman Teresa Palmer Sam Reid Drama Thriller
452,Un sac de billes,Christian Duguay Dorian Le Clech Batyste Fleurial Patrick Bruel Drama
453,Addicted to Porn: Chasing the Cardboard Butterfly,
454,Ripped,Brad Epstein Alex Meneses Faizon Love Russell Peters Comedy
455,Firebase,Neill Blomkamp Steve Boyle Nic Rhind Robert Hobbs Action Sci-Fi War
456,Edith Walks,
457,City of Ghosts,
458,Chasing Coral,Jeff Orlowski Andrew Ackerman Pim Bongaerts Neal Cantin Documentary
459,This Is Everything: Gigi Gorgeous,
460,78/52,Alexandre O. Philippe Guillermo del Toro Peter Bogdanovich Karyn Kusama Documentary
461,Water & Power: A California Heist,
462,What the Health,Kip Andersen Keegan Kuhn Kip Andersen Larry Baldwin Neal Barnard Documentary
463,Joshua: Teenager vs. Superpower,
464,Revolt,Joe Miale Lee Pace Bérénice Marlohe Jason Flemyng Sci-Fi
465,Hickok,Timothy Woodward Jr. Luke Hemsworth Trace Adkins Bruce Dern Western
466,Do You Take This Man,Joshua Tunick Anthony Rapp Alona Tal Alyson Hannigan Drama
467,The Dark Tower,Nikolaj Arcel Idris Elba Matthew McConaughey Tom Taylor Action Western Sci-Fi Fantasy Horror
468,Soundtrack,300ml Selton Mello Ralph Ineson Seu Jorge Drama
469,ماجرای نیمروز,Mohammad Hossein Mahdavian Mehrdad Sedighian Babak Hamidian Javad Ezati Action Crime History
470,Inconceivable,Jonathan Baker Nicolas Cage Gina Gershon Nicky Whelan Thriller Drama
471,Bon Cop Bad Cop 2,Alain Desrochers Patrick Huard Colm Feore Erik Knudsen Crime Comedy Action
472,Security,Alain Desrochers Antonio Banderas Ben Kingsley Liam McIntyre Action
473,Overdrive,Antonio Negret Scott Eastwood Freddie Thorp Ana de Armas Thriller Action
474,Speech & Debate,Dan Harris Liam James Sarah Steele Austin P. McKenzie Comedy Drama
475,Tour de Pharmacy,Jake Szymanski Orlando Bloom Andy Samberg John Cena Comedy TV Movie
476,サバイバルファミリー,Shinobu Yaguchi Fumiyo Kohinata Eri Fukatsu Yuki Izumisawa 
477,Dirty Dancing,Wayne Blair Abigail Breslin Colt Prattes Sarah Hyland Music Drama Romance TV Movie
478,Devil's Gate,Clay Staub Milo Ventimiglia Bridget Regan Amanda Schull Sci-Fi Thriller
479,Abduction,Molly Smith Maurice Smith Karolina Antosik Amelie Leroy Tessa McGinn Fantasy Drama
480,Obit,Vanessa Gould William McDonald Bruce Weber Margalit Fox Documentary
481,The Truth Is in the Stars,Craig Thompson William Shatner Neil deGrasse Tyson Chris Hadfield Documentary
482,The Emoji Movie,Anthony Leondis T.J. Miller James Corden Anna Faris Comedy Family Animation
483,Bedeviled,Abel Vang Burlee Vang Saxon Sharbino Bonnie Morgan Brandon Soo Hoo Horror Thriller
484,The Saint,Ernie Barbarash Adam Rayner Eliza Dushku Ian Ogilvy Action Adventure Crime
485,Mamma o papà?,Riccardo Milani Paola Cortellesi Antonio Albanese Carlo Buccirosso Comedy
486,The Hippopotamus,John Jencks Roger Allam Matthew Modine Tim McInnerny Comedy
487,Wind River,Taylor Sheridan Jeremy Renner Elizabeth Olsen Gil Birmingham Action Crime Mystery Thriller
488,Rory Scovel Tries Stand-Up for the First Time,
489,The Nile Hilton Incident,Tarik Saleh Fares Fares Mari Malek Mohamed Yousry Thriller Drama
490,Блокбастер,Roman Volobuev Svetlana Ustinova Anna Chipovskaya Yevgeni Tsyganov Comedy Crime
491,Shot Caller,Ric Roman Waugh Nikolaj Coster-Waldau Jon Bernthal Lake Bell Drama Crime Thriller
492,Mike Birbiglia: Thank God for Jokes,
493,Chris D'Elia: Man on Fire,
494,S.W.A.T.: Under Siege,Tony Giglio Adrianne Palicki Michael Jai White Ty Olsson Action Crime Thriller
495,Микита Кожум'яка,Manuk Depoyan Arsen Shavlyuk Vasyl Virastyuk Ruslana Pysanka Family Comedy Animation Fantasy Adventure
496,First Round Down,
497,Zygote,
498,Wish Upon,John R. Leonetti Joey King Ryan Phillippe Sherilyn Fenn Fantasy Horror Thriller
499,Girls Trip,Malcolm D. Lee Regina Hall Queen Latifah Jada Pinkett Smith Comedy
500,Landline,Gillian Robespierre Jenny Slate Edie Falco Abby Quinn Comedy
501,Detroit,Kathryn Bigelow John Boyega Will Poulter Algee Smith Thriller Crime Drama History
502,Columbus,Kogonada John Cho Haley Lu Richardson Parker Posey Drama
503,Fittest On Earth: A Decade Of Fitness,Heber Cannon Marston Sawyers Ian Wittenber Mariah Moore Matt Fraser Ben Smith Sara Sigmundsdottir Documentary
504,Zero 3,Emilis Velyvis Inga Jankauskaitė Mindaugas Papinigis Ramūnas Rudokas Thriller
505,Feed,Tommy Bertelsen Troian Bellisario Tom Felton Ben Winchell Drama
506,The Girl from the Song,Ibai Abad Lewis Rainer Joséphine Berry Charlotte Atkinson Drama Music Romance
507,Selbstkritik eines bürgerlichen Hundes,Julian Radlmaier Julian Radlmaier Deragh Campbell Beniamin Forthi Comedy
508,Sahara,Pierre Coré Omar Sy Louane Emera Franck Gastambide Adventure Animation Comedy Family
509,L'Amant double,François Ozon Marine Vacth Jérémie Renier Jacqueline Bisset Thriller
510,First Kill,Steven C. Miller Bruce Willis Hayden Christensen Gethin Anthony Action Thriller
511,LA 92,T.J. Martin Daniel Lindsay Rodney King Tom Brokaw George H. W. Bush Documentary
512,Descendants 2,Kenny Ortega Dove Cameron Sofia Carson Cameron Boyce TV Movie Family Action Comedy Music Adventure
513,Ivanka Trump- America's Real First Lady?,
514,Chris Gethard: Career Suicide,
515,Lou,
516,Sztuka kochania. Historia Michaliny Wisłockiej,Maria Sadowska Magdalena Boczarska Piotr Adamczyk Justyna Wasilewska Drama
517,Es war einmal in Deutschland,Sam Garbarski Anatole Taubman Moritz Bleibtreu Joel Basman Comedy Drama War
518,American Violence,Timothy Woodward Jr. Kaiwi Lyman Bruce Dern Denise Richards Crime Drama Thriller
519,À bras ouverts,Philippe de Chauveron Christian Clavier Ary Abittan Elsa Zylberstein Comedy
520,La mécanique de l'ombre,Thomas Kruithof François Cluzet Denis Podalydès Sami Bouajila Thriller
521,LEGO DC Super Hero Girls: Brain Drain,Todd Grimes Grey Griffin Tara Strong Anais Fairweather Animation
522,Take Me,Pat Healy Taylor Schilling Pat Healy Alycia Delmore Comedy Crime
523,फिल्लौरी,Anshai Lal Anushka Sharma Diljit Dosanjh Suraj Sharma Fantasy Comedy Romance Drama
524,The Incredible Jessica James,Jim Strouse Jessica Williams Chris O'Dowd Keith Stanfield Romance Comedy
525,Can't Buy My Love,Farhad Mann Adelaide Kane Benjamin Hollingsworth Jean Louisa Kelly Romance
526,Lauri Mäntyvaaran tuuheet ripset,Hannaleena Hauru Inka Haapamäki Rosa Honkonen Tiitus Rantala Romance Comedy
527,Cop and a Half: New Recruit,Jonathan A. Rosenbaum Lou Diamond Phillips Wallace Shawn Gina Holden Crime Comedy Action Family
528,In a Heartbeat,
529,Maa,Ravi Udyawar Sridevi Kapoor Sajal Ali Akshaye Khanna Crime Drama Thriller
530,Queerama,
